{
  "$schema": "./schema.json",
  "lot_size": 0.01,
  "stop_loss": 100,
  "take_profit": 200,
  "symbol": "XAUUSD",
  "timeframe": "M1",
  "risk_mode": "conservative",
  "dca_enabled": false,
  "trading": {
    "trading_enabled": false,
    "dry_run": true,
    "poll_interval_sec": 1.0
  },
  "execution": {
    "max_spread_points": 0,
    "max_entry_drift_points": 0,
    "max_slippage_points": 30
  },
  "symbols": {
    "default": ["XAUUSD"],
    "symbol_map": {
      "XAUUSD": "XAUUSD"
    }
  },
  "telemetry": {
    "telegram_enabled": false
  },
  "platform": {
    "default_webhook_port": 8017,
    "needs_inbound_webhook": true
  }
}
